,Headline,Time,Impact,Direction,Period
0," de energia Espana: 28,00 (-14,4%) Francia: 30,00 (-17,9%) Gas spot TTF: 5,50 (-55,3%) Carbon: €/ton: 17,00 (-50,0%) Mas informacion aqui. Resumen: El mercado energético ha experimentado un descenso de precios a niveles historicos debido a la abundancia de energías renovables, el desplome de la demanda y de las materias primas. El precio de la electricidad en el mercado mayorista se ha situado en 17,65 €/MWh, su nivel más bajo en se",2020-04-01,9,Down,Short
1," encima del cierre de diciembre y del que marcaba en enero de 2019. Esto se debe a que Espana se ha visto mas expuesta al desabastecimiento de gas que el resto de Europa por su menor stock almacenado, su mayor dependencia del GNL y el menor volumen que ha recibido desde Argelia, que ha destinado parte de su produccion a Asia. Además, la ausencia de producción eólica ha hecho que los ciclos combinados repercutan la subida del gas, elevando puntualmente el precio de",2021-01-01,8,Up,Short
2,"inanda asiatica de gas suben un 43% el precio mayorista de la luz Un frente frio en Asia ha disparado la demanda de gas en el continente, provocando un desabastecimiento en Europa que ha afectado mas al mercado espanol. El precio de la energia ha subido un 43% respecto al mes pasado, un 46,4% con relacion a enero de 2020 y un 15,2% por encima de la media de los ultimos cinco anos de enero. Las renovables han respondido a mas de la mitad de la demanda a pesar de su",2021-01-01,8,Up,Short
3," diez dias, desde los 40,22 €/MWh al cierre del mes pasado hasta los 38,94 €/MWh el pasado 15 de febrero. El Q3-21 se mantiene estable en los 37,08 €/MWh.

Resumen:
El precio del mercado mayorista (POOL) de electricidad en España disminuyó un 54% en la primera quincena de febrero, situándose a la mitad del precio de otros países europeos como Francia, Alemania e Italia. Esto se debe a la elevada generación ren",2021-02-01,8,Down,Short
4,"rico.

The energy market has seen a significant increase in prices due to the decline in wind energy production and the high costs of gas and CO2 emissions. The POOL market has increased by 63% since the start of March, which is 67% higher than the start of the pandemic a year ago. Wind energy production in the first two weeks of March has been 30% lower than the same time last year and 25% below the average for March in the past five years. Gas prices have doubled since last year and CO2 emission rights have reached a record high of 43 €/t. This has led to higher production costs for combined cycle plants, which are being passed on to consumers through their offers to the electricity market.",2021-03-01,8,Up,Short
5,"211. Esto se debe al encarecimiento del gas, que triplica su precio respecto a 2019, y al incremento de las emisiones de carbono. Los precios de los futuros de gas y de carbono (EUA) se encuentran en máximos historicos a corto plazo, como consecuencia de la fuerte demanda y de la debil oferta. Sin embargo, el precio de los futuros de electricidad a largo plazo se encuentra en mínimos historicos, reflejando la gran cantidad de capacidad instalada y la b",2021-06-01,9,Up,Long
6,"atiaica (11,7%) El gas solo produce un 13% del mix, pero marca el techo de precios. La primera causa de la subida del precio de la electricidad es el gas. Esta subida se debe a la escasez de oferta mundial, que ha provocado una subida de 500% en el precio del gas en Europa. Esta situacion se ve agravada por el factor climatologico, que influye en la demanda de gas en todo el mundo. Esto se ve reflejado en el precio de la electricidad, que se ha triplicado en Europa. Par",2021-07-01,8,Up,Long
7,"étereos, puedan cumplir estos objetivos. Por ello, el mercado de emisiones de CO2 se ha encarecido un 150% en el ultimo ano. Aunque el precio sigue siendo bajo en relacion con la economia real, el encarecimiento de las emisiones repercute en el precio de la electricidad.

En resumen, la Unión Europea ha reforzado su compromiso con la descarbonización a pesar del alto precio de la energía. Esto ha llevado a un aumento del 150% en el precio de las",2021-07-01,8,Up,Long
8,"ada de generacion hidraulica y de gas, que son mas caras, y ha marcado los precios de casacion. 

The energy market in Europe is currently experiencing the largest price increase in its history, driven by two main factors: a 1000% annual increase in global gas prices and a high carbon emissions price due to EU decarbonization policies. The rapid growth of wind and solar power installed in Spain in recent years, combined with stagnant demand, should have resulted in cheaper technologies replacing hydraulic and gas generation. However, this summer, prices in solar radiation peak hours have remained high due to the inexplicable reduction of wind power generation during daytime hours. This has favored the entry of more expensive hydraulic and gas generation",2021-08-01,8,Up,Mid
9,"23,7%) a la segunda posicion. Los precios del gas alcanzan maximos historicos Los precios del gas tambien se han disparado. El precio diario de la red de transporte ha superado los 70 €/MWh el pasado mes de agosto, una cifra que no se habia alcanzado desde el ano 2008. Los futuros para el invierno tambien han subido un 200% respecto al ano pasado. https://mail.google.com/mail/u/0/?ik=f164bc5761&view=pt&search=all&permmsgid",2021-09-01,9,Up,Short
10," destruccion de empleos e inversiones, una amenaza para el crecimiento economico.

The energy market is facing an unprecedented crisis due to the increasing cost of energy in Europe. The gas market has driven the price of electricity futures for the first quarter of 2022 above 215 €/MWh. Many small electricity and gas retailers cannot support the rising prices due to inadequate coverage, while larger companies are canceling contracts due to government legislation. The daily price of the wholesale market (POOL) in September was 156.14 €/MWh, the highest since records began. This is 47.5% higher than August and an extraordinary 272% higher than a year ago. If the energy supply",2021-09-01,9,Up,Long
11,"re Conclusiones El precio de la electricidad en el mercado mayorista se encuentra un 298% por encima de la media de los ultimos cinco anos de un mes de octubre. Esto se debe a una combinacion de factores: el aumento de la potencia instalada de ciclos combinados, la disminucion de la potencia de eolica y hidraulica, y la reduccion de la demanda de electricidad. Esta situacion provoca que algunas eléctricas anuncien una retirada de sus ofertas de generacion de energias renovables",2021-10-01,9,Up,Past
12,"uelo, 2 | 41005 | SEVILLA | ESPAÑA https://mail.google.com/mail/u/0/?ik=f164bc5761 &view=pt&search=all&permmsgid=ms¢g-f: 1718115631464338972&simpl=msog-f:17181156314643... 3/3

En el mercado de energía, el precio diario del mercado mayorista (POOL) se ha situado en 193,43 €/MWh en noviembre, un 3,2% más bajo que el precio del pasado mes de octubre",2021-11-01,4,Down,Short
13,"net Con el anticiclon manteniendo un precio de 200 €/MWh en el mercado eléctrico espanol, la generación de los ciclos combinados de gas se ha disparado un 371%, mientras que la generación de energías renovables se ha reducido un 36%. Los futuros eléctricos cortan a corto plazo pero crecen a largo plazo, llegando a 125 €/MWh en el Yr-23 y 85 €/MWh en el Yr-24. En el resto del continente, Italia es el único país con preci",2022-02-01,9,Up,Long
14," ni versitat Jaume | - El temor a una interrupcion de suministro ruso dispara los precios energeticos europeos un 40% Conclusiones El temor a una posible interrupcion de suministro ruso ha provocado un aumento de los precios energéticos europeos. Esto ha generado una volatilidad en los mercados de futuros y una reduccion de la liquidez. Por otra parte, la escasa generacion renovable en Espana debido a la situacion anticiclonica y de sequia asociada, ha encare",2022-02-01,9,Up,Short
15,"ll https://mail.google.com/mail/u/0/?ik=f164bc5761 &view=pt&search=all&permmsgid=ms¢g-f: 172364464 1487791929&simpl=msg-f: 172364464 1487791929& 3/3

The energy market has seen a rise in gas prices due to the conflict in Ukraine and colder temperatures in Asia. This has caused electricity prices to remain above 200 €/MWh in the coming months. Renewable energy production has decreased by 23%, while CCG production has increased by 139%. Demand has decreased by 5.6% in January. The average daily price of the wholesale market (PO",2022-02-01,8,Up,Mid
16,"énica para la regasificacion y almacenamiento de gas natural licuado, se esta viendo una reduccion del precio del gas y electricidad en comparacion con el resto de Europa. Esto se debe a que estos paises tienen mayor flexibilidad para absorber los picos de la demanda, algo que no se ve en los paises con menos capacidad de almacenamiento. El plan europeo REpowerEU transformara los mercados energéticos mundiales. Se trata de un plan a largo plazo que busca reducir el consumo de combustibles fosiles",2022-05-01,8,Down,Long
17,"ccion con carbén se ha visto limitada por los altos costes de la materia prima. Esto ha provocado una reduccion de los precios del POOL en Espana. El mecanismo de tope al precio del gas, aplicado en junio, ha tenido un efecto limitado sobre el precio de la electricidad para los consumidores. La demanda de electricidad debida a las altas temperaturas ha hecho subir los precios, y el ajuste de compensacion ha anulado el efecto de la reduccion del precio del OMIE. La batalla de",2022-06-01,7,Down,Mid
18," precios anteriores. El precio diario del gas en el mercado holandés (TTF) se ha situado en el mes de julio en los 24,9 €/MWh, aumentando un 45% desde el 1 de enero. En este contexto, el mercado espanol MIBGAS amplia su descuento sobre el TTF holandés a niveles historicos y el ahorro de gas para Espana sera de solo el 7%, frente al 15% de la UE. La electricidad espanola, a pesar de ser mas cara que nunca, es un 26% mas barata que",2022-07-01,8,Up,Mid
19,"iba a ser inferior al tope establecido por el Ministerio de Transicion Energetica (50 €/MWh). Esto provoco una caida mas acusada del precio del gas, que ha llegado a situarse en los 25 €/MWh. Los cuellos de botella provocan una caida del precio del gas Una de las principales causas de esta caida en el precio del gas es la ausencia de cuellos de botella en la red de transporte. Esto provoca una sobreoferta de gas en el mercado, lo que ha llevado a una caida en",2022-10-01,7,Down,Long
20,"idad un 4,1% La demanda diaria de electricidad diaria en Espana se ha situado en 46.764 GWh, un 4,1% menos que en octubre. La demanda de gas para la generacion electrica ha caido un 30,4%, a 5.357 GWh. La demanda industrial se ha desplomado un 15,3%, situandose en los 4.527 GWh. La demanda domestica ha bajado un 5,5%, hasta los 8.639 GWh. La demanda asiatica de GNL sigue dormida https://mail.google.com/mail/u/0/?ik=",2022-11-01,6,Down,Mid
21," a un nivel bajo (1.087 GWh) debido a la falta de precipitaciones. https://mail.google.com/mail/u/0/?ik=f164bc5761 &view=pt&search=all&permmsgid=ms¢o-f: 17567 10385723392890&simpl=msg-f: 17567103857233... 3/7

The energy market in Spain saw record renewable energy production in January of 2023, leading to the lowest electricity prices in 15 months. Exports of electricity decreased by 21.3%, imports of natural gas fell to their lowest level since September 2021, and spot prices for",2023-01-01,7,Down,Mid
22,"ia demanda, el precio del mercado mayorista alcanza los niveles mas bajos. Esta situacion se ha producido en la segunda semana de marzo, con una produccion eolica de 10.832 MW, superior a la demanda (8.735 MW). La demanda energetica de la industria frena su caida A pesar de la reduccion de la actividad industrial, la demanda de electricidad sigue siendo superior a la del año pasado. Esta tendencia se ha mantenido durante todo el mes de marzo, con una media diaria de 39.7",2023-03-01,5,Down,Mid
23,"ia nacional electricidad MIBGAS Precio medio diario (€/MWh) | 80 70 60 50 40 30 20 10 0 En resumen, el precio de la electricidad ha bajado un 32,14% respecto a febrero debido al descenso de la demanda (-4,6%), el aumento de la generacion fotovoltaica (+108,6%) y el descenso de la demanda de gas (-16,4%). Esto ha provocado una curva de precios cada vez mas volatil, con precios muy bajos en las horas solares y precios much",2023-03-01,5,Down,Mid
24," (3,9%) Resumen: El informe del mercado energético de mayo de 2023 informa que el precio de la electricidad ha aumentado un 5,98% en la primera mitad de mayo, pero todavía es un 58,2% más barato que hace un año. Esto se debe a la fuerte reducción del precio del gas, el hundimiento de la demanda y el incremento de la generación fotovoltaica y eólica. La generación fotovoltaica y eólica compensan el descenso de la producci",2023-05-01,8,Down,Mid
25,"ítular ENERGIA Y GESTION ASE S.L. con la finalidad de prestarle un mejor servicio. Puede ejercitar los derechos de acceso, rectificacion, cancelacion y oposicion dirigiendo una comunicacion a ENERGIA Y GESTION ASE S.L. a la direccion de correo ase@grupoase.net https://mail.google.com/mail/u/0/?ik=f164bc5761 &view=pt&search=all&permmsgid=ms¢o-f: 1767568754458832304&simpl=msg-",2023-05-01,3,None,None
